Job Title,Company,Location,Via,Age,Time,Link
Software Customer Support Engineer,Toronto Metropolitan University,"Toronto, ON",via Magnet - WhoPlusYou,2 days ago,Full-time,https://g.co/kgs/9YYjGf
Security Engineer,Quantum Technology Recruiting Inc. (QTR),"Toronto, ON",via LinkedIn,10 hours ago,Full-time,https://g.co/kgs/F35LHG
Senior Cloud Security Engineer,Snowflake,Canada,via Glassdoor,1 day ago,Full-time,https://g.co/kgs/8wJwnL
software engineer,TRIBALSCALE INC.,"Toronto, ON",via Job Bank,2 days ago,Full-time,https://g.co/kgs/pXhqfx
Lead Security Engineer,Morningstar,"Toronto, ON",via Glassdoor,2 days ago,Full-time,https://g.co/kgs/FP35C3
Physical Design Silicon Engineer Full Chip Floorplanning,AMD,"Markham, ON",via Discover Technata Job Board,3 days ago,Full-time,https://g.co/kgs/FhCx61
"Deskside Engineer, Information Technology",KORNFERRY,"Toronto, ON",via Glassdoor,1 day ago,Full-time,https://g.co/kgs/d7w2Ym
software engineer,Vastai Technologies Canada Inc.,"Markham, ON",via Job Bank,2 days ago,Full-time,https://g.co/kgs/rrSDM3
